"address","infoSnippet","name","phone","rating","reviewSnippet","url","website"
"4045 Bonita Rd, Bonita, CA 91902","Let our office help you with medical care, temporary disability benefits, permanent disability benefits, supplemental job displacement benefits, vocational…","Carriedo Carlos R Law Offices","(619) 470-1131",,,"https://www.yellowpages.com/bonita-ca/mip/carriedo-carlos-r-law-offices-16700014?lid=1000613046899","http://www.carriedolaw.com"
"20980 Redwood Rd Ste 240, Castro Valley, CA 94546",,"Law Office of Pardeep S. Grewal","(510) 889-1999","5","I want thanks to The Law Office of Pardeep S Grewal. He helped my relative who lives in Castro valley. I appreciate your efforts and dedication.""","https://www.yellowpages.com/castro-valley-ca/mip/law-office-of-pardeep-s-grewal-1671464?lid=1001071472080","http://www.pardeeplaw.com"
"115 W Walnut St, Lodi, CA 95240",,"Fluetsch & Fluetsch","(209) 367-8888","5","I found myself in a really terrible situation where unfortunately I was in need of an attorney . I am also a disabled person so especially needed assistance asap. I would…","https://www.yellowpages.com/lodi-ca/mip/fluetsch-fluetsch-16746065?lid=1002004434466","http://www.fluetschlaw.com"
"475 El Camino Real Suite 300, Millbrae, CA 94030","Serving the San Francisco Peninsula","Katz Charles J Attorney At Law","(650) 692-4100",,,"https://www.yellowpages.com/millbrae-ca/mip/katz-charles-j-attorney-at-law-16781027?lid=1000966232972","http://www.charlesjkatzlaw.com"
"1385 Ridgewood Dr, Chico, CA 95973",,"Cohen Sharon RN Attorney At Law","(530) 345-6343","5","Sharon and her entire staff have stuck with me through the never ending paper work and doctor visits that the government demands. I never could understand why a person who has…","https://www.yellowpages.com/chico-ca/mip/cohen-sharon-rn-attorney-at-law-16813776?lid=1001614064871",
,"Established in 1993, the business offers Professional Law Services.","Knox Julia H Attorney at Law","(707) 928-4872",,,"https://www.yellowpages.com/nationwide/mip/knox-julia-h-attorney-at-law-16818495?lid=1001130420183",
"827 W Center Ave, Visalia, CA 93291",,"Allen Law Firm","(559) 627-3855","5","David W. Allen and his staff are extremely helpful and honest! I would definitely recommend him to my family, friends, or anyone who needs expert legal help.""","https://www.yellowpages.com/visalia-ca/mip/allen-law-firm-16836287?lid=1000658576783",
"587 Jefferson St, Napa, CA 94559",,"Ellen York","(707) 224-7971",,,"https://www.yellowpages.com/napa-ca/mip/ellen-york-1689404?lid=1000082794080","http://yorkyorklaw.com"
"600 E Main St Ste 100, Turlock, CA 95380",,"Law Offices of Axel B. Gomez","(209) 668-1410","5","Helped me with bankruptcy and I didn't had to trial every time. He took care of it.""","https://www.yellowpages.com/turlock-ca/mip/law-offices-of-axel-b-gomez-16903622?lid=1000437163627","http://www.axelgomez.com"
"6820 Indiana Ave, Riverside, CA 92506",,"The Law Offices Of Dr. Peter M. Schaeffer","(951) 302-0400","5","Peter Schaeffer to save the day! I definitely recommend calling the Law Office of Dr Peter M Schaeffer""","https://www.yellowpages.com/riverside-ca/mip/the-law-offices-of-dr-peter-m-schaeffer-17102298?lid=1000116637548","http://lawofficeofpeterschaeffer.com"
"1601 Eastman Ave Unit 101, Ventura, CA 93003","When you are injured on the job or your medical condition prevents you from performing your normal job tasks, you might be entitled to compensation and…","Law Office of John Sugden","(805) 658-1652",,,"https://www.yellowpages.com/ventura-ca/mip/law-office-of-john-sugden-17398564?lid=1000893682785",
"15315 Magnolia Blvd, Sherman Oaks, CA 91403",,"Lowenstein Disability Lawyers","(818) 905-6611","5","Mr. Lowenstein is one of the best attorneys I have ever dealt with.  His office is low-key and professional.  They really know how to get the job done.  He is honest.  His…","https://www.yellowpages.com/sherman-oaks-ca/mip/lowenstein-disability-lawyers-17875855?lid=1000088493797","http://www.lowensteindisability.com"
"20532 El Toro Rd Ste 207, Mission Viejo, CA 92692","Where experienced, knowledgeable representation meets affordability. Our motto is: try to settle first, if that's not possible, then aggressively litigate.","The Rancho Family Law Center","(949) 600-7571",,,"https://www.yellowpages.com/mission-viejo-ca/mip/the-rancho-family-law-center-17922321?lid=1000558418774","http://theranchofamilylawcenter.com"
"2780 Skypark Dr Ste 325, Torrance, CA 90505",,"The Edgecumbe Law Firm","(310) 784-2512","5","If there were 6 stars available I would have given that many.  Mr. Edgecumbe is an excellent Attorney.  Not only does he have an extraordinary comprehension of the law, but he…","https://www.yellowpages.com/torrance-ca/mip/the-edgecumbe-law-firm-18017117?lid=1000439482157","http://www.edgecumbelaw.com"
"20885 Redwood Rd Suite 337, Castro Valley, CA 94546","*Registered and Bonded *Serving Papers Since 1992 *We Offer Professional Legal Support Services to Both the Public, and to Private Legal Organizations *All of…","Wolf-Pac Services","(510) 872-5260",,,"https://www.yellowpages.com/castro-valley-ca/mip/wolf-pac-services-18149615?lid=1001266312953","http://www.justprocess.com"
"3580 Wilshire Blvd Ste 1798A, Los Angeles, CA 90010",,"Jones Eric L Law Offices","(213) 738-7838","5","My case has not been done yet, but I like this lawyer very much. He is really interested to help you, not to rip you off as many other do.""","https://www.yellowpages.com/los-angeles-ca/mip/jones-eric-l-law-offices-18214212?lid=1000439534176",
"242 Sand Hill Cir, Menlo Park, CA 94025",,"Law Offices Stephen benda","(650) 323-6600",,,"https://www.yellowpages.com/menlo-park-ca/mip/law-offices-stephen-benda-18405124?lid=1001140432284",
"1617 W Shaw Ave, Fresno, CA 93711",,"Rod Haron","(559) 441-1421","5","Mr. Haron is very knowledgeable, very sensitive and cares about his clients. He got me the settlement I did not expect at all! I did not realize my case was worth so much. Mr.…","https://www.yellowpages.com/fresno-ca/mip/rod-haron-18539310?lid=1001957219983","http://rodharonlaw.com"
,,"AAA Disability Help","(530) 626-0156","5","Very helpful. I broke down on the side of the freeway and they got me and my car to a safe place....""","https://www.yellowpages.com/nationwide/mip/aaa-disability-help-18966089?lid=1000115489485",
"250 D St, Santa Rosa, CA 95404","Law & Mediation Offices Construction, Real Property , Personal Injury and Litigation, Mediation","James K Cobb Attorney At Law","(707) 571-8112",,,"https://www.yellowpages.com/santa-rosa-ca/mip/james-k-cobb-attorney-at-law-19059174?lid=1001686338091","http://www.rogowaylaw.com"
"1362 Pacific Ave, Santa Cruz, CA 95060","Let Arturo Rodriguez put his 30 years of trial experience to work for you. In addition to his law degree Arturo has an MA in Counseling. Call Arturo if you need…","Arturo Rodriguez","(831) 471-9444",,,"https://www.yellowpages.com/santa-cruz-ca/mip/arturo-rodriguez-1906419?lid=1000997508848",
"8300 Fair Oaks Blvd, Carmichael, CA 95608","AAA California Divorce & Bankruptcy Assistance has been serving the Sacramento area since March 1995. We have been at the same address for more than 20-years and…","Aaa California Divorce & bankruptcy assistance","(916) 944-8898",,,"https://www.yellowpages.com/carmichael-ca/mip/aaa-california-divorce-bankruptcy-assistance-1913318?lid=1000116670193","http://divbk.com"
"1220 Howard Ave Ste 250, Burlingame, CA 94010",,"Collins Law Office","(650) 348-1974","1","Read this article in 1993 regarding his overbilling charges:http://www.nytimes.com/1993/11/12/technology/bar-court-asks-lawyer-if-computer-doing-most-work-why-big-fee.html-He…","https://www.yellowpages.com/burlingame-ca/mip/collins-law-office-19187319?lid=1000437167514",
"1650 Oregon St, Redding, CA 96001","ABC Paralega provides attorney,bankruptcy services services","ABC Paralegal","(530) 241-5421",,,"https://www.yellowpages.com/redding-ca/mip/abc-paralegal-19873512?lid=1001027770151",
"37 Old Courthouse Sq Ste 100, Santa Rosa, CA 95404","The Sonoma County Bar Association serves the interests of the community as well as the legal professionals in Sonoma County. Please feel welcome to contact us…","Sonoma County Lawyer Referral","(707) 546-5297",,,"https://www.yellowpages.com/santa-rosa-ca/mip/sonoma-county-lawyer-referral-2022416?lid=1000997511360","http://www.sonomacountybar.org"
"3500 W Olive Ave Fl 300, Burbank, CA 91505",,"Murphy Michael C APC","(818) 558-3718",,,"https://www.yellowpages.com/burbank-ca/mip/murphy-michael-c-apc-20846097?lid=1000088485685",
"2101 4th St, Santa Rosa, CA 95404","The Work Injury Law Center is a Bay Area law firm specializing in the representation of injured workers in California. Our practice is dedicated to vigorously…","Bloom John A Law Offices Of","(707) 524-1144",,,"https://www.yellowpages.com/santa-rosa-ca/mip/bloom-john-a-law-offices-of-2138828?lid=1000997508911","http://www.workinjurylawcenter.com"
"1290 B St, Hayward, CA 94541",,"Goodman Louis J Attorney At Law","(510) 582-9090",,,"https://www.yellowpages.com/hayward-ca/mip/goodman-louis-j-attorney-at-law-2183605?lid=1000997510602","http://www.louisgoodman.com"
"225 Broadway Ste 1450, San Diego, CA 92101",,"Erickson Law Firm A.P.C.","(619) 231-9920",,,"https://www.yellowpages.com/san-diego-ca/mip/erickson-law-firm-a-p-c-21887231?lid=1001734254990","http://www.ericksonlaw.com"
"2124 Eureka Way, Redding, CA 96001",,"Law Office Of Daniel T. Mosier","(530) 241-1492",,,"https://www.yellowpages.com/redding-ca/mip/law-office-of-daniel-t-mosier-21920360?lid=1000088617954",
"1574 West St, Redding, CA 96001","Rhonda M. Hixon, Attorney at Law, former prosecutor, probation officer, and judge pro tempore, has more than 30 years of experience as a trial attorney…","Rhonda Hixon,   Attorney","(530) 244-9686",,,"https://www.yellowpages.com/redding-ca/mip/rhonda-hixon-attorney-21920553?lid=1000088567664","http://www.hixondefense.com"
"1503 S Coast Dr Ste 209, Costa Mesa, CA 92626","Please Contact Us for More Information","Weber & Firman, Atty At Law","(714) 957-2533",,,"https://www.yellowpages.com/costa-mesa-ca/mip/weber-firman-atty-at-law-21924980?lid=1001137473961","http://www.stopdebt.com"
"1043 Civic Center Drive West, Santa Ana, CA 92703","Extensive Criminal Trial Experience, Experienced Trial Attorney and Respected Negotiator, DMV Hearings, DUI and All Misdemeanors, Serious and Violent Felonies,…","Medina  David Law Offices Of","(714) 647-1350",,,"https://www.yellowpages.com/santa-ana-ca/mip/medina-david-law-offices-of-21937230?lid=1001558830872","http://davidmedinalaw.com"
"654 W Main St, El Centro, CA 92243","The Firm of Anderholt & Storey, APLC is a full service law office with three attorneys, paralegals and legal secretaries and has provided legal services in…","Law Offices of Thomas W. Storey","(760) 352-1311",,,"https://www.yellowpages.com/el-centro-ca/mip/law-offices-of-thomas-w-storey-21946677?lid=1000507693929","http://tomstoreylaw.com"
"14156 Magnolia Blvd, Sherman Oaks, CA 91423","At The Horowitz Law Firm we are experienced attorneys providing high quality, cost-effective service and client-focused solutions. The Horowitz Law Firm provides…","The Horowitz Law Firm","(818) 907-8000",,,"https://www.yellowpages.com/sherman-oaks-ca/mip/the-horowitz-law-firm-21958594?lid=1001920730146","http://www.jdhorowitzlaw.com"
,,"Law Office Of Stanley A Zamel","(818) 469-3030","5","Outstanding, highly professional, competent -- and saved me plenty of $$$ with just some friendly advice!!!!!""","https://www.yellowpages.com/nationwide/mip/law-office-of-stanley-a-zamel-21959508?lid=1001571492044",
"55 River St, Santa Cruz, CA 95060",,"Hamlyn & Guerrero Attorney's At Law","(831) 420-3500","5","They are very good and professional people. I would recommend it to everyone who needs help. I'm so happy!""","https://www.yellowpages.com/santa-cruz-ca/mip/hamlyn-guerrero-attorneys-at-law-21960492?lid=1001484096801",
"123 Jewell St, Santa Cruz, CA 95060","Douglas Kane is an attorney in Santa Cruz, California, representing plaintiffs in employment discrimination, harassment and wrongful termination cases. His…","Kane Douglas C Attorney At Law","(831) 459-8000",,,"https://www.yellowpages.com/santa-cruz-ca/mip/kane-douglas-c-attorney-at-law-21961451?lid=1001722492876","http://www.protectingrights.net"
"245 W Laurel Dr, Salinas, CA 93906","A Law Practice With Over 30 Years Experience Dedicated To Helping Injured People * State Bar Certified Worker's Compensation Specialists * Experienced Trial…","Rucka O'Boyle Lombardo & McKenna","(831) 443-1051",,,"https://www.yellowpages.com/salinas-ca/mip/rucka-oboyle-lombardo-mckenna-21965678?lid=1001329788631","http://www.rolmlawyers.com"
"1516 Tarrytown St, San Mateo, CA 94402",,"Newhouse, David E & Associates","(650) 348-8652","5","this is to inform you that your business name of american law associates is being abused by the following:michael fuller representing himself from this business and also kevin…","https://www.yellowpages.com/san-mateo-ca/mip/newhouse-david-e-associates-21971990?lid=1001509384596","http://www.attycubed.com"
"917 Missouri St, Fairfield, CA 94533","Over 30 years experience as a former Deputy District Attorney and Criminal Defense Lawyer in Solano County, with experience in the Bay Area, Southern California,…","Chris Jackson Attorney At Law","(707) 205-6486",,,"https://www.yellowpages.com/fairfield-ca/mip/chris-jackson-attorney-at-law-21975973?lid=1001961538644","http://cjackson-lawyer.com"
"341 Flume St, Chico, CA 95928",,"John V. Johnson & Joanne Hamilton","(530) 893-0696",,,"https://www.yellowpages.com/chico-ca/mip/john-v-johnson-joanne-hamilton-21977586?lid=1001933052991",
"505 Sansome St Ste 1525, San Francisco, CA 94111","Construction, Real Estate and Public Contract Attorneys for Businesses, Professionals and Individuals in the San Francisco Bay Area and Northern California.","Law Office of George William Wolff & Associates","(415) 788-1881",,,"https://www.yellowpages.com/san-francisco-ca/mip/law-office-of-george-william-wolff-associates-21983668?lid=1000437163122","http://www.wolfflaw.com"
"27240 Turnberry Ln Ste 200, Valencia, CA 91355",,"The Law Offices of Gerald L. Marcus","(661) 274-7774",,,"https://www.yellowpages.com/valencia-ca/mip/the-law-offices-of-gerald-l-marcus-21984152?lid=1000116528121","http://www.geraldmarcuslaw.com/Lancaster.aspx"
"706 Ferry St, Martinez, CA 94553","Specializing in personal injury cases, wrongful death, criminal defense and DUI cases over the past 46 years.","Angelo J Costanza Attorney at Law","(925) 228-2885",,,"https://www.yellowpages.com/martinez-ca/mip/angelo-j-costanza-attorney-at-law-21986156?lid=1001202631011","http://www.costanzalaw.com"
"4 N 2nd St Ste 280, San Jose, CA 95113","Because I am a solo practitioner, if you elect to retain me as your attorney; I will personally handle and manage your case. When you have questions about your…","Law Office of BAO-QUAN P. PHAM","(408) 275-6701",,,"https://www.yellowpages.com/san-jose-ca/mip/law-office-of-bao-quan-p-pham-21991206?lid=1000907945850",
"64 W Santa Clara St, San Jose, CA 95113","Serving California and the Greater San Francisco Bay Area since the 1920s","Campbell Warburton Fitzsimmons Smith Mendell & Pastore","(408) 295-7701",,,"https://www.yellowpages.com/san-jose-ca/mip/campbell-warburton-fitzsimmons-smith-mendell-pastore-21991215?lid=1000115266984","http://www.campbellwarburton.com"
"10663 Yarmouth Ave, Granada Hills, CA 91344",,"Law Offices of Savin & Bursk","(818) 368-8646","5","Arnold Gross assisted me with a recent auto accident case.  His professional guidance and direction helped to make this very stressful ordeal palatable.  He explained to me the…","https://www.yellowpages.com/granada-hills-ca/mip/law-offices-of-savin-bursk-21991585?lid=1001071657161","http://www.savinbursklaw.com"
"5050 Sunrise Blvd Ste C1, Fair Oaks, CA 95628",,"Samuel and Samuel Attorneys At Law","(916) 966-4722","5","If you need an attorney go see Peter Samuel! Great guy! He's helped me out a few times over the past 20 years.""","https://www.yellowpages.com/fair-oaks-ca/mip/samuel-and-samuel-attorneys-at-law-21991960?lid=1001784038532",
"12150 Herdal Dr, Auburn, CA 95603",,"Larry T Ring - Law Office Of Larry T Ring","(530) 885-7836","5","Larry Ring is an excellent advocate. He is detailed and thorough.  Mr Ring brings several professional perspectives to the table giving his clients a full understanding of his…","https://www.yellowpages.com/auburn-ca/mip/larry-t-ring-law-office-of-larry-t-ring-21993302?lid=1001509389349","http://www.lringlaw.com"
"501 Stockton Ave, San Jose, CA 95126","* This Is A Debt Relief Practice. We Help People Eliminate Their Debt. * Free Consultation. * Debt Problems? Don't Panic, Call Me For Your Free Consultation.","David Trapp Attorney At Law","(408) 298-2566",,,"https://www.yellowpages.com/san-jose-ca/mip/david-trapp-attorney-at-law-21993434?lid=1001477873399",
"3130 W Main St Ste F, Visalia, CA 93291","* Asset Protection Planning * Business & Corporate Law * Living Trusts * Probate Law * Real Estate Law * Tax Law * Wills, Trust & Estate Law","Yahnian Law Corporation","(559) 733-8505",,,"https://www.yellowpages.com/visalia-ca/mip/yahnian-law-corporation-21995779?lid=1001065189329","http://www.yahnian.com"
"100 Mason St, Ste. 100, Vacaville, CA 95688","We help people achieve their goals through estate planning, administration, litigation and alternate dispute resolution. Achieving the result you want requires…","Knitter & Knitter LLP","(707) 469-8880",,,"https://www.yellowpages.com/vacaville-ca/mip/knitter-knitter-llp-21996793?lid=1001961538776","http://www.knitterlamping.com"
"3461 Brookside Rd Suite C,, Stockton, CA 95219",,"Law Offices Of Ronald Stein","(209) 957-9744","5","Excellent Service, above and beyond expectations.Legal Team is the best, very reasonable price and always return your calls, very nice!!""","https://www.yellowpages.com/stockton-ca/mip/law-offices-of-ronald-stein-21997519?lid=1001588610065","http://ronsteinlaw.com"
"1956 Webster St Ste 275, Oakland, CA 94612",,"Law Office Of Andrew Wolff PC","(510) 834-3300","5","I am a foreign person here for an exchange for two years. Mr. Wolff helped me with my injury case. He is very professional and kind to me. I was very happy with the results.""","https://www.yellowpages.com/oakland-ca/mip/law-office-of-andrew-wolff-pc-21997862?lid=1000437172386","http://www.awolfflaw.com"
"343 E Main St, Stockton, CA 95202","WE SPECIALIZE IN AGGRESSIVE, PERSONAL REPRESENTATION REPRESENTING INDIVIDUALS AND FAMILIES","Judicare","(209) 943-5674",,,"https://www.yellowpages.com/stockton-ca/mip/judicare-21998023?lid=1001597704356","http://craigmarkslaw.com"
"3414 Brookside Rd, Stockton, CA 95219","At Hakeem Ellis And Marengo, our experienced lawyers can represent you in a variety of issues, including Family Law, Corporate, Estate Planning, Civil…","Hakeem Ellis And Marengo","(209) 474-2800",,,"https://www.yellowpages.com/stockton-ca/mip/hakeem-ellis-and-marengo-21998375?lid=1001716974004","http://www.hakeemellismarengo.com"
"700 S Claremont St, San Mateo, CA 94402","*Please Call us for More Information. We provide aggressive representation.","Scotto Vincent J. III Law Offices Of","(650) 401-6161",,,"https://www.yellowpages.com/san-mateo-ca/mip/scotto-vincent-j-iii-law-offices-of-22048345?lid=1002004604038","http://www.scottolaw.com"
,"We provide quality services at reasonable rates, and we accept payment plans. Our offices provide appointments outside of normal business hours for those with…","Aparicio-Mercado & Associates","(213) 627-0770",,,"https://www.yellowpages.com/nationwide/mip/aparicio-mercado-associates-22051180?lid=1000437163480","http://www.amlawyer.info"
"127 Jewell St, Santa Cruz, CA 95060",,"Jackson James A","(831) 688-6002",,,"https://www.yellowpages.com/santa-cruz-ca/mip/jackson-james-a-22077046?lid=1001722494165","https://www.freedomok.net/aptos-lawyer"
"1600 S Main St Ste 185, Walnut Creek, CA 94596",,"Walnut Creek Family Law Center Inc","(925) 930-7000","5","Aggressive attorneys who are not afraid to fight for their clients.  They specialize in family law including divorce, custody, support and visitation.  While in the office,…","https://www.yellowpages.com/walnut-creek-ca/mip/walnut-creek-family-law-center-inc-22125339?lid=1000439498081","http://wcfamilylaw.com"
,,"Reifler Law Offices","(707) 665-5861",,,"https://www.yellowpages.com/nationwide/mip/reifler-law-offices-22164287?lid=1000116714829","http://www.reiflerlawoffices.com"
"608 University Ave, Sacramento, CA 95825","A SACRAMENTO LAW FIRM COMMITTED TO EXCEPTIONAL QUALITY REPRESENTATION. Specializing in business litigation, construction defect litigation, insurance coverage…","Sacino Bertolino & Hallissy","(916) 649-2214",,,"https://www.yellowpages.com/sacramento-ca/mip/sacino-bertolino-hallissy-22352220?lid=1001511523272","http://www.sbhlawoffice.com"
"3510 Unocal Pl, Santa Rosa, CA 95403",,"Law Offices of Thomas F. Byrne","(707) 303-1437","5","I highly recommend Tom. He supported our family through a very difficult and emotional family civil lawsuit.  He showed a lot of compassion, understanding, and empathy. …","https://www.yellowpages.com/santa-rosa-ca/mip/law-offices-of-thomas-f-byrne-22369569?lid=1000088571881",
"122 Calistoga Rd, Santa Rosa, CA 95409",,"Sizemore Patrick Law Office","(707) 538-1061",,,"https://www.yellowpages.com/santa-rosa-ca/mip/sizemore-patrick-law-office-2240257?lid=1000997507332",
"770 COUNTY SQUARE DRIVE Ste 215, Ventura, CA 93003","Being charged with a criminal offense may be one of the most challenging and uncertain times of your life. You do not have to go through it alone. Call us and we…","David Lehr Law","(805) 477-0070",,,"https://www.yellowpages.com/ventura-ca/mip/david-lehr-law-22418223?lid=1000088624228","http://www.davidlehrlaw.com"
"790 Mission Ave, San Rafael, CA 94901","The Law Offices of Clyde H. Charlton is a full service Elder Law and Estate Planning firm, dedicated to providing every client with compassionate service and…","Charlton Clyde H Law Offices","(415) 485-2200",,,"https://www.yellowpages.com/san-rafael-ca/mip/charlton-clyde-h-law-offices-2258795?lid=1001063716668",
"310 Capitol St Ste A, Salinas, CA 93901","The Law Firm of Lavorato & Scott provides experienced, responsive, thoughtful legal representation to individuals and families throughout Monterey County and San…","Lavorato & Scott","(831) 758-3000",,,"https://www.yellowpages.com/salinas-ca/mip/lavorato-scott-22679948?lid=1000115335455","https://www.lavoratoandscott.com"
"499 Hemsted Dr Ste B, Redding, CA 96002","Our company is to connect customers with the most trusted sources of generic and brand medicine suppliers in the world. We are the team of the professionals that…","Ayres Law Office","(530) 229-1340",,,"https://www.yellowpages.com/redding-ca/mip/ayres-law-office-22771079?lid=1001953038310","http://ayreslaw.net"
,"Attorney Anh Quoc Duy Nguyen and his associates have appeared before judges and juries in both state and federal courts all over the country, and have delivered…","Nguyen Anh Quoc Duy","(714) 530-9800",,,"https://www.yellowpages.com/nationwide/mip/nguyen-anh-quoc-duy-22846230?lid=1000507689553","http://anhlaw.com"
"565 W College Ave, Santa Rosa, CA 95401",,"DeMeo DeMeo & West Lawyers","(707) 545-3232",,,"https://www.yellowpages.com/santa-rosa-ca/mip/demeo-demeo-west-lawyers-22913316?lid=1000866975023",
,"For over 30 Years, Ralph Torres has developed one of the Fresno areas premier Criminal Defense practices. From capital murder charges to domestic violence, your…","Ralph Torres Attorney at Law","(559) 233-3600",,,"https://www.yellowpages.com/nationwide/mip/ralph-torres-attorney-at-law-22929291?lid=1000621577198","http://www.rtorreslaw.net"
"2377 Gold Meadow Way, Gold River, CA 95670","CA Board of Legal Specialization - Certified Specialist in Probate, Estate Planning & Trust Law.","Seaman & Seaman A Law Corporation","(916) 484-7084","3",,"https://www.yellowpages.com/gold-river-ca/mip/seaman-seaman-a-law-corporation-23020383?lid=1000875181476","http://www.seamanlaw.com"
"791 N Cherry St, Tulare, CA 93274",,"Horswill Mederos, Soares & Ormonde Attorneys At Law","(559) 686-3861",,,"https://www.yellowpages.com/tulare-ca/mip/horswill-mederos-soares-ormonde-attorneys-at-law-2376363?lid=1000439587931","http://www.tulareesq.com"
"2601 24th Ave, Sacramento, CA 95820",,"Linda Dankman Attorney At Law","(916) 442-1155",,,"https://www.yellowpages.com/sacramento-ca/mip/linda-dankman-attorney-at-law-2377642?lid=1001189532964",
"15760 Ventura Blvd Ste 700, Encino, CA 91436","Law Offices of Harvey I. Levin has earned a solid reputation for providing the highest quality legal services in a broad range of substantive areas. This firm…","Law Offices Of Harvey I Levin","(818) 995-9444",,,"https://www.yellowpages.com/encino-ca/mip/law-offices-of-harvey-i-levin-2416187?lid=1000115402102","http://www.harveylevinlaw.com"
"620 Capitola Ave, Capitola, CA 95010","Monterey Bay Properties was founded in 1980 by Walter Hickey and continues to be locally owned and operated by his son John Hickey. Monterey Bay Properties is…","Monterey Bay Properties","(831) 476-9661",,,"https://www.yellowpages.com/capitola-ca/mip/monterey-bay-properties-2583728?lid=1001978407672","http://montereybayprop.com"
"1050 S Kimball Rd, Ventura, CA 93004","Ferguson Case Orr Paterson LLP opened its doors in the beautiful city of Ventura, California a quarter century ago. As Ventura County has transitioned from an…","Ferguson Case Orr Paterson LLP","(805) 659-6800",,,"https://www.yellowpages.com/ventura-ca/mip/ferguson-case-orr-paterson-llp-2626753?lid=1001991430963","https://www.fcoplaw.com"
