"address","infoSnippet","name","phone","rating","reviewSnippet","url","website"
"912 Perdew Ave, Ridgecrest, CA 93555",,"Law Office of Wayne Silva","(760) 463-0839","5","Very helpful and easy to work with. Thank you Silva Law""","https://www.yellowpages.com/ridgecrest-ca/mip/law-office-of-wayne-silva-13171359?lid=1002166444109","http://waynesilvalaw.com"
"4129 Main St, Riverside, CA 92501","The Riverside County Bar Association Lawyer Referral Service (LRS) is the only lawyer referral service exclusively dedicated to serving the legal needs of the…","lawyer Referral  Services Of Riverside County","(951) 335-0144",,,"https://www.yellowpages.com/riverside-ca/mip/lawyer-referral-services-of-riverside-county-13264329?lid=1002117655345","http://riversidelrs.org"
"30011 Ivy Glenn Dr, Laguna Niguel, CA 92677","Mr. Ettinghoff is a licensed real estate attorney and real estate broker. He has more than 25 years of experience in all real estate matters.","Ettinghoff Tracy H Law Offices Of","(949) 363-5573",,,"https://www.yellowpages.com/laguna-niguel-ca/mip/ettinghoff-tracy-h-law-offices-of-13309433?lid=1000088593079","http://www.ettinghoff.com"
"15497 W Sand St Ste 100, Victorville, CA 92392","When preparing to journey on the path of any legal issues, there are three key things that you need to know right now more than anything else: Family law is very…","Thompson Law Office","(760) 780-1254",,,"https://www.yellowpages.com/victorville-ca/mip/thompson-law-office-13500634?lid=1002118775957","http://www.thompsonfamilylawspecialist.com"
"400 Santa Clara Street Suite 102, Vallejo, CA 94590","Wright and Falls was founded in 1971 as Ury & Wright. We represent injured workers in Napa, Vallejo, Fairfield, Vacaville, American Canyon, Yountville, Lake…","Wright  Grady J Attorney At Law","(707) 552-2298",,,"https://www.yellowpages.com/vallejo-ca/mip/wright-grady-j-attorney-at-law-1357284?lid=1002063570784","http://www.wrightandsiemont.com"
"11726 San Vicente Blvd, Los Angeles, CA 90049","Graylaw continues to assist immigrants in their endeavors to realize the American dream. To date, Graylaw has been successful in providing legal services to…","Gray Humberto R","(310) 447-6577",,,"https://www.yellowpages.com/los-angeles-ca/mip/gray-humberto-r-14060681?lid=1002004401783","http://www.graylaw.com"
"904 W Center Ave, Visalia, CA 93291",,"Minyard: David Attorney","(559) 635-4794",,,"https://www.yellowpages.com/visalia-ca/mip/minyard-david-attorney-14578852?lid=1000088475970","http://www.davidminyardlaw.com"
"777 E Tahquitz Canyon Way Ste 200-152, Palm Springs, CA 92262","About Forrest F. Wolfe Established in 1998, the Law Offices of Forrest F. Wolfe offers Free Initial Consultations in the areas of Estate Planning and Probate.…","Law Offices of Forrest F. Wolfe","(760) 459-2611",,,"https://www.yellowpages.com/palm-springs-ca/mip/law-offices-of-forrest-f-wolfe-14869031?lid=1001749897622","http://www.trustwolfe.com"
"41240 11th St W, Palmdale, CA 93551",,"Derryberry & Associates","(661) 367-1779","4","This business is extremely professional and personable.  I went into see mr. Derryberry for a simple trust and will.  He was very informative and honest.  I must have called 10…","https://www.yellowpages.com/palmdale-ca/mip/derryberry-associates-14997175?lid=1000911682640","https://www.derryberrylawyers.com"
"1626 19th St, Bakersfield, CA 93301",,"Darling And Wilson pc","(661) 325-5075","5","I highly recommend Joah Wilson if you need a trust or will. He is very personable, knowledgable, and professional.  I have referred many clients to him. They all are happy with…","https://www.yellowpages.com/bakersfield-ca/mip/darling-and-wilson-pc-15116275?lid=171683378","http://www.dwlawfirm.com"
"3111 Camino Del Rio N Ste 950, San Diego, CA 92108",,"Goldberg Jones - Divorce For Men","(619) 243-0888","4.5","My experience @ Goldberg-Jones is nothing but exceptional. Attorney Andy Mitchel took my case as if it was his own. His photographic memory coupled with his mastery of family…","https://www.yellowpages.com/san-diego-ca/mip/goldberg-jones-divorce-for-men-1540871?lid=1002173420298","https://www.goldbergjones-sandiego.com"
"818 College Ave, Santa Rosa, CA 95404",,"Zatman Murray & Associates","(707) 542-9700","5",".""","https://www.yellowpages.com/santa-rosa-ca/mip/zatman-murray-associates-15451931?lid=205920524",
"1735 J St, Arcata, CA 95521",,"A-7 Day A Week Notary Service","(707) 498-5732","5","#1 Notary in Humboldt! Excellent service even though I had to get a document notarized 3 times he still only charged me for one! Thanks Gilbert!! 5 Stars!""","https://www.yellowpages.com/arcata-ca/mip/a-7-day-a-week-notary-service-16210628?lid=1000229909490",
"424 F. Street, San Diego, CA 92101","The law firm of Marc Carlos Law, APC., is recognized as one of San Diego and the Southern California regions premier criminal defense firms, with over 30 years…","Marc Carlos Law APC","(619) 736-2520",,,"https://www.yellowpages.com/san-diego-ca/mip/marc-carlos-law-apc-16691338?lid=1000427699960","http://www.marccarloslaw.com"
"750 Menlo Ave, Menlo Park, CA 94025","The law office of Barbara J. Kiem, based in Menlo Park, CA, specializes in offering her clients affordable estate plans","Kiem Barbara J Attorney At Law","(650) 324-8502",,,"https://www.yellowpages.com/menlo-park-ca/mip/kiem-barbara-j-attorney-at-law-16885965?lid=1000115204529",
"706 Main St, Martinez, CA 94553",,"Hermelin Law Firm","(925) 228-6500",,,"https://www.yellowpages.com/martinez-ca/mip/hermelin-law-firm-1692104?lid=197543236","http://www.hermelinlaw.com"
"219 Nogales Ave Suite B, Santa Barbara, CA 93105","We are a locally owned and operated physicians’ office in the Santa Barbara area specializing in internal medicine. New patients are always welcome to call us…","William C. Koonce, MD","(805) 682-7200",,,"https://www.yellowpages.com/santa-barbara-ca/mip/william-c-koonce-md-17021347?lid=1002004470841","https://www.cottagehealth.org/find-a-doctor/profile/william-koonce-santa-barbara-internal-medicine"
"5951 Encina Rd, Goleta, CA 93117","David Holzman and John Sprague make up the firm of Hourigan, Holzman & Sprague. With 30 years experience practicing workers' compensation law on the Central…","Hourigan Holzman & Sprague","(805) 967-6765",,,"https://www.yellowpages.com/goleta-ca/mip/hourigan-holzman-sprague-17921223?lid=1002005778878","http://santabarbaraworkerscomp.com"
"1901 1st Ave, San Diego, CA 92101",,"Stearns Christopher Attorney and Counselor at Law","(619) 233-3341","5","Excellent Attorney. I highly recommend Mr. Stearns. He's very attentive to your needs as an Attorney""","https://www.yellowpages.com/san-diego-ca/mip/stearns-christopher-attorney-and-counselor-at-law-1944027?lid=1000433332390",
"674 County Square Dr, Ventura, CA 93003","It was established in 1983 and incorporated in California. Current estimates show this company has an annual revenue of less than $500,000 and employs a staff of…","Steven A Debbas Attorney At Law","(805) 856-2691",,,"https://www.yellowpages.com/ventura-ca/mip/steven-a-debbas-attorney-at-law-19558885?lid=1002109799046",
"1043 Civic Center Drive West, Santa Ana, CA 92703","Extensive Criminal Trial Experience, Experienced Trial Attorney and Respected Negotiator, DMV Hearings, DUI and All Misdemeanors, Serious and Violent Felonies,…","Medina  David Law Offices Of","(714) 623-7244",,,"https://www.yellowpages.com/santa-ana-ca/mip/medina-david-law-offices-of-21937230?lid=1002006564235","http://davidmedinalaw.com"
,"""Northern Nevada's Premier Personal Injury Attorneys - No Fee Unless We Win Your Case - For the past five decades, our law firm has provided an unparalleled…","Bradley, Drendel & Jeanney","(775) 384-8835",,,"https://www.yellowpages.com/reno-nv/mip/bradley-drendel-jeanney-21956382?lid=1002025603819","https://www.bdjlaw.com"
"422 Truxtun Ave, Bakersfield, CA 93301",,"Law Offices of David Faulkner","(661) 324-4777","5","David Faulkner and his staff are very courteous, honest and professional. He took care of everything for me without the stress that is involved with court proceedings, etc. He…","https://www.yellowpages.com/bakersfield-ca/mip/law-offices-of-david-faulkner-21960168?lid=1001685814099","http://www.bakersfielddefenseattorney.com"
"413 F St, Davis, CA 95616","* Attorneys - Immigration & Naturalization Law * Please Visit Our Website for More Information","Moore & Moore Attorneys At Law","(530) 758-8317",,,"https://www.yellowpages.com/davis-ca/mip/moore-moore-attorneys-at-law-21989961?lid=209992725","http://www.mytrustedlawyer.com"
"424 2nd St Ste A, Davis, CA 95616","There’s a way out. There’s hope. This is the one thing my clients need to understand when they sit across from me and open up about one of the most agonizing…","Reynolds Law Corp","(530) 297-5030",,,"https://www.yellowpages.com/davis-ca/mip/reynolds-law-corp-21990285?lid=1001484506417","http://reynoldslawcorporation.com"
"34 Summit St Ste B, Jackson, CA 95642","* Attorney at Law* General Practice","Headley, Frances","(209) 257-4733",,,"https://www.yellowpages.com/jackson-ca/mip/headley-frances-21993076?lid=1001792116263","http://www.francesheadley.com"
"190 S. Orchard Avenue Ste A-100, Vacaville, CA 95688","Competent legal assistance can help you obtain a fresh start. I represent families, small business owners and individuals who are faced with legal and financial…","Ritzinger David P Law Office Of","(707) 365-6510",,,"https://www.yellowpages.com/vacaville-ca/mip/ritzinger-david-p-law-office-of-21996306?lid=1001616288162","http://www.davidritzinger.com"
"400 Oceangate Ste 800, Long Beach, CA 90802","At Bergkvist, Bergkvist & Carter LLP is a general civil litigation law firm emphasizing real estate, business, estate planning, and probate matters. Senior…","Bergkvist, Bergkvist & Carter LLP","(562) 452-9660",,,"https://www.yellowpages.com/long-beach-ca/mip/bergkvist-bergkvist-carter-llp-22253688?lid=1002153354418","http://lawbbc.com"
"421 13th, Modesto, CA 95354","PERSONAL INJURY, WORKERS' COMP, SOCIAL SECURITY","Nelson  Gary Law Office CALIFORNIA","(209) 524-9200",,,"https://www.yellowpages.com/modesto-ca/mip/nelson-gary-law-office-california-22385645?lid=1002014688976","http://www.garynelsonlaw.com"
"397 Third Ave Ste C, Chula Vista, CA 91910","Chula Vista Divorce lawyer, Chula Vista Divorce attorney, and San Diego Divorce Mediator. Providing divorce mediation and attorney services to help clients…","A Healthy Divorce","(619) 425-8613",,,"https://www.yellowpages.com/chula-vista-ca/mip/a-healthy-divorce-23017218?lid=1001838843039","http://www.ahealthydivorce.com"
"1011 A St, Antioch, CA 94509","At Hobin & Hobin LLP we are passionate about providing expert legal services to our community. We are proud that we have been a trusted law firm in Contra Costa…","Hobin & Hobin LLP Attorneys at Law","(925) 301-8624",,,"https://www.yellowpages.com/antioch-ca/mip/hobin-hobin-llp-attorneys-at-law-23201592?lid=193189636","http://www.hobinlaw.com"
"3727 Sunset Ln Ste 109, Antioch, CA 94509",,"Dunford Law Group","(925) 529-4394","5","Gemelo  S.I was a client of  Misha Dunford who handled my case with utmost professionalism, leadership and energy. She was always available to listen to all of my concerns and…","https://www.yellowpages.com/antioch-ca/mip/dunford-law-group-23263134?lid=1002173406800","http://www.dunfordlaw.com/"
"1475 6th Ave, Ste 501, San Diego, CA 92101","The Law Office of Gary W. Powell provides caring legal guidance to clients dealing with Estate Planning, Probate and Trust matters. Service clients in San Diego,…","Law Office Of Gary W Powell","(619) 685-6975",,,"https://www.yellowpages.com/san-diego-ca/mip/law-office-of-gary-w-powell-2575109?lid=1002153381820","http://www.garypowellestplanning.com"
"239 Main St. Suite H, Pleasanton, CA 94566","Legal problems can affect multiple areas of your life. At the Law Offices of John A. Guthrie, we take a comprehensive approach to solving difficult family law…","Law Offices of John A. Guthrie","(925) 461-9898",,,"https://www.yellowpages.com/pleasanton-ca/mip/law-offices-of-john-a-guthrie-2601062?lid=1000099166086","https://www.johnaguthrielaw.com"
"14335 Park Ave, Ste A, Victorville, CA 92392",,"Zumbrunn Law Corp","(760) 269-3462","5","Honesty and integrity, those are two words that will always be associated with Greg Zumbrunn. When I decided to retain Greg to assist me through my divorce it was one of the…","https://www.yellowpages.com/victorville-ca/mip/zumbrunn-law-corp-2764888?lid=1002116240827","http://zumbrunnlaw.com"
"814 14th St Ste A, Modesto, CA 95354",,"Jensen  Leslie F","(209) 524-3688","5","Leslie Jensen is superb. She guided and supported me every step of the way. She really cared about my case and is still there for me to answer any questions even though my case…","https://www.yellowpages.com/modesto-ca/mip/jensen-leslie-f-2857399?lid=1002104396584","https://lfjensenlaw.us"
"3625 E Thousand Oaks Blvd Ste 113, Westlake Village, CA 91362","Patricia A. Mann specializes in Family Law and has been serving Ventura County since 1989. Located in Westlake Village, Patti is a Member of Collaborative Family…","Mann Patricia Attorney At Law","(805) 842-0051",,,"https://www.yellowpages.com/westlake-village-ca/mip/mann-patricia-attorney-at-law-3012957?lid=1002162407794",
"6780 N West Ave, Fresno, CA 93711",,"Todd B. Barsotti A Professional Law Corporation","(559) 420-7894",,,"https://www.yellowpages.com/fresno-ca/mip/todd-b-barsotti-a-professional-law-corporation-3039355?lid=1000647205480","http://www.barsotti-law.com"
"68828 Ramon Rd, Ste C2, Cathedral City, CA 92234","The Law Offices Of Muro & Muro of Cathedral City California is a family Owned and Operated law firm with over 27 years of experience. Muro & Muro will fight for…","Muro & Muro Law Offices","(760) 537-5359",,,"https://www.yellowpages.com/cathedral-city-ca/mip/muro-muro-law-offices-3187720?lid=1002153370507",
"1714 Olive St, Santa Barbara, CA 93101","I am a sole practitioner. I have focused my practice on family law since joining the Bar in 1976 and I have emphasized mediation since 1978. I have successfully…","Nancy J Madsen, Attorney & Mediator","(805) 564-4481",,,"https://www.yellowpages.com/santa-barbara-ca/mip/nancy-j-madsen-attorney-mediator-3324611?lid=1002055527039","https://www.nolo.com/lawyers/profile/nancy-jane-madsen-547.html"
"14350 Civic Dr, Victorville, CA 92392","Helping you accomplish your personal and professional financial goals is our priority. By utilizing our firm you will receive the exceptional service, attention…","Miers & Miers Certified Public Accountants LLP","(760) 245-5341",,,"https://www.yellowpages.com/victorville-ca/mip/miers-miers-certified-public-accountants-llp-3483642?lid=1001780050729","http://mierscpa.com"
"1114 State St, Santa Barbara, CA 93101","My name is Stephan T. Frank, Attorney at Law, and I have been practicing law since 1971. I have the experience and expertise that comes with over 40 years…","Frank Stephen T Attorney","(805) 319-4280",,,"https://www.yellowpages.com/santa-barbara-ca/mip/frank-stephen-t-attorney-3556299?lid=1002108845374",
"279 E H St., Benicia, CA 94510","A Preeminent Employment Law Firm Serving Businesses and Individuals For Over 28 Years","Barnum & Avila Law Offices Of","(707) 745-3747",,,"https://www.yellowpages.com/benicia-ca/mip/barnum-avila-law-offices-of-3871677?lid=1001572528737","http://www.rmblaw.com"
"636 W State St, El Centro, CA 92243","At Ewing Johnson & Graves Professional Law Corporation, we handle a wide range of services in business law to guarantee smooth operation as well as resolution of…","Ewing Johnson & Graves Professional Law Corporation","(760) 483-9872",,,"https://www.yellowpages.com/el-centro-ca/mip/ewing-johnson-graves-professional-law-corporation-4081477?lid=278163890","http://www.ewingjohnsongraveslaw.com"
"1849 Knoll Dr, Ventura, CA 93003",,"Baskin Robert M Law Offices Of","(805) 639-8135","3","My step father who is deceased ,was a court judge. I know Mr baskin and his office worked til the very end and pursued every avenue.  It was an emotional and very important…","https://www.yellowpages.com/ventura-ca/mip/baskin-robert-m-law-offices-of-4120878?lid=1002173406690","http://www.robertmbaskin.com/"
"275 E Douglas Ave, El Cajon, CA 92020","* Former Instructor Cuyamaca Community College * President of the Foothills Bar Association of San Diego County in 1999 * East County Attorney & Citizen For Over…","Buchenau Thomas M Law Offices","(619) 493-0360",,,"https://www.yellowpages.com/el-cajon-ca/mip/buchenau-thomas-m-law-offices-4288951?lid=348666417","http://www.elcajonlaw.com"
"2801 Salinas Hwy, Monterey, CA 93940","Fenton & Keller is a law firm that specializes in the practice of civil, business and employment law. The firm represents clients in matters concerning…","Fenton & Keller","(831) 373-1241",,,"https://www.yellowpages.com/monterey-ca/mip/fenton-keller-431951?lid=1001809827431","http://fentonkeller.com/contact-us"
"1342 Esplanade, Chico, CA 95926",,"Richard S Matson Law Office Inc","(530) 343-5373",,,"https://www.yellowpages.com/chico-ca/mip/richard-s-matson-law-office-inc-4437168?lid=1001829253097",
,"We represent individuals and groups of people who have been financially abused or otherwise ""ripped off"" by careless or dishonest companies. This is divided into…","Bernstein Scot D Law Offices APC","(888) 381-0639",,,"https://www.yellowpages.com/nationwide/mip/bernstein-scot-d-law-offices-apc-450802383?lid=1002173409632","http://www.sbernsteinlaw.com"
"16820 Ivy Ave, Fontana, CA 92335","The office of Edward G. Operini practices law in Fontana, California and San Bernardino Co..Our entire staff is dedicated to helping clients with their legal…","Edward G. Operini","(909) 822-5041",,,"https://www.yellowpages.com/fontana-ca/mip/edward-g-operini-453590083?lid=1002112664432","http://www.operini.com"
"155 Montgomery St, Ste 1004, San Francisco, CA 94104","James Lance Kaller is an attorney located in San Francisco, California. He specializes in Estate Planning, Wills, Guardianships, Trusts, and Probate. Practicing…","Kaller, James Lance","(415) 636-7054",,,"https://www.yellowpages.com/san-francisco-ca/mip/kaller-james-lance-453647414?lid=1002105046780",
"5080 California Ave Ste 425, Bakersfield, CA 93309",,"Attorney's Certified Services","(661) 327-8022","5","I have used Attorney Certified Services (ACS) for a number of legal-related requests over the years.  Having had poor experiences with other services, I was pleased the first…","https://www.yellowpages.com/bakersfield-ca/mip/attorneys-certified-services-453763258?lid=1002004416826","http://www.attorneyscertified.com"
"6355 Topanga Canyon Blvd, Woodland Hills, CA 91367",,"John P. Rosenberg, A Professional Law Corporation","(818) 716-6400","5","In working with John Rosenberg for the last four years I have found him to be knowledgable and extremely professional. Mr Rosenberg and his staff work hard for thier clients…","https://www.yellowpages.com/woodland-hills-ca/mip/john-p-rosenberg-a-professional-law-corporation-455419049?lid=1001641663082","http://www.jrosenberg.com"
"237 Jones St, Murphys, CA 95247",,"Shafer Claudia Y Attorney At Law","(209) 728-1543",,,"https://www.yellowpages.com/murphys-ca/mip/shafer-claudia-y-attorney-at-law-456260671?lid=1002073218164",
"23300 Cinema Dr Ste 2910, Valencia, CA 91355","The Law Offices of David M. Wallin is comprised of a knowledgeable and experienced team that provides defense for the criminally accused throughout Santa…","Law Offices of David M. Wallin","(661) 222-2253",,,"https://www.yellowpages.com/valencia-ca/mip/law-offices-of-david-m-wallin-458515376?lid=1000675119309","https://palmdalecriminaldefenselawfirm.com"
"1432 E Divisadero St, Fresno, CA 93721",,"Perez Williams Medina & Rodriguez LLP","(559) 445-0123","5","I was rear-ended by a young man and his insurance company accepted 100% of the liability. I talked to 3 other different attorneys and they said I can do it myself and if I…","https://www.yellowpages.com/fresno-ca/mip/perez-williams-medina-rodriguez-llp-458833144?lid=1001766851038","http://www.pwmrlaw.com"
"1300 Oliver Rd Ste 390, Fairfield, CA 94534","The Scalise Law Office has been providing legal services in Fairfield, CA and the surrounding area for over 23 years. Our attorney, Joseph M. Scalise’s legal…","Scalise Law Office","(707) 759-4230",,,"https://www.yellowpages.com/fairfield-ca/mip/scalise-law-office-458953312?lid=1001922404614","http://scaliselawoffice.com"
"3111 Camino Del Rio Ste 400, San Diego, CA 92108","When you need an attorney in San Diego, CA, rely on The Law Office of Jane E Engelman. We offer legal representation for a variety of case types including…","Engelman Jane Law Offices Of","(619) 908-1052",,,"https://www.yellowpages.com/san-diego-ca/mip/engelman-jane-law-offices-of-459347079?lid=1002145278683","http://workerscomplawsd.com"
,"At the Law Office of Karen L. Winters, our attorneys help people and businesses in Nevada and California resolve current legal issues successfully and establish…","Law Office of Karen L Winters","(775) 309-4726",,,"https://www.yellowpages.com/minden-nv/mip/law-office-of-karen-l-winters-459422230?lid=1002166496386","http://nevada-law.us"
"98 Del Monte Avenue, Suite #200, Monterey, CA 93940",,"Scott Shaffman Attorney At Law","(831) 200-3021","5","He provided me with a very experienced, sincere consultation. I would definitely recommend if you are looking for a very friendly/sincere attorney""","https://www.yellowpages.com/monterey-ca/mip/scott-shaffman-attorney-at-law-459507776?lid=1002042934033","https://www.erisaattorneyshaffman.com"
"207 N Pine St, Nevada City, CA 95959","Nancy Christie Attorney and Mediator has been practicing law in the Nevada City, California area. She is an experienced attorney and will speak to you about your…","Christie Nancy Attorney-Mediator","(530) 478-0208",,,"https://www.yellowpages.com/nevada-city-ca/mip/christie-nancy-attorney-mediator-460612049?lid=1001895146156","https://www.attorneyyellowpages.com/divorce/christie-nancy-attorney-mediator"
"820 W 18th St, Merced, CA 95340","There is no need to face legal situations alone. Albertoni and Associates of Merced, CA, practice in the areas of Family Law, Criminal Law, Wills, Trusts, and…","Albertoni & Associates","(209) 720-4907",,,"https://www.yellowpages.com/merced-ca/mip/albertoni-associates-460673530?lid=1002153291873","http://www.mercedlaw.com"
"1181 Puerta Del Sol Ste 120, San Clemente, CA 92673","long from ASCP","Castagno Joseph D","(949) 482-3542",,,"https://www.yellowpages.com/san-clemente-ca/mip/castagno-joseph-d-460765192?lid=1001166009374","http://www.castagnolawfirm.com"
"2950 Feather River Blvd, Oroville, CA 95965","Attorney Raoul J. LeClerc was admitted to the California Bar Association in 1966 and has been serving the legal needs of the Butte County community ever…","Law Office of Raoul J LeClerc","(530) 533-5661",,,"https://www.yellowpages.com/oroville-ca/mip/law-office-of-raoul-j-leclerc-461704612?lid=1000223868576","http://www.leclerclawoffice.com"
"2064 Talbert Dr, Chico, CA 95928","Heather L. Siles and Steven J. Foster are the attorneys which make up the law firm of Siles & Foster. Heather Siles and Steven Foster are both certified as…","Siles &  Foster","(530) 433-9616",,,"https://www.yellowpages.com/chico-ca/mip/siles-foster-461719380?lid=1002166408532","http://www.siles-foster.com"
"30101 Town Center Dr, Laguna Niguel, CA 92677",,"Gil  May Attorney At Law","(949) 544-3421",,,"https://www.yellowpages.com/laguna-niguel-ca/mip/gil-may-attorney-at-law-461724061?lid=171691502","http://www.gilmaylawyer.com"
"7144 Fair Oaks Blvd Ste B, Carmichael, CA 95608","The firm's practice is primarily in the area of estate planning, Wills and trusts, probate, conservatorships and guardianships and estate administration.…","Cameron Law Office","(916) 438-9033",,,"https://www.yellowpages.com/carmichael-ca/mip/cameron-law-office-461725369?lid=1002173409126",
"30101 Town Center Dr, Laguna Niguel, CA 92677",,"Gil  May Attorney At Law","(949) 544-3421",,,"https://www.yellowpages.com/laguna-niguel-ca/mip/gil-may-attorney-at-law-461724061?lid=171691502","http://www.gilmaylawyer.com"
"7144 Fair Oaks Blvd Ste B, Carmichael, CA 95608","The firm's practice is primarily in the area of estate planning, Wills and trusts, probate, conservatorships and guardianships and estate administration.…","Cameron Law Office","(916) 438-9033",,,"https://www.yellowpages.com/carmichael-ca/mip/cameron-law-office-461725369?lid=1002173409126",
"444 S 8th St Ste A, El Centro, CA 92243",,"Pace Patrick M.","(760) 483-9013",,,"https://www.yellowpages.com/el-centro-ca/mip/pace-patrick-m-461725765?lid=202954222","http://www.awebsitecomingsoon.com"
"1055 N Euclid Ave, Ontario, CA 91762","About Forrest F. Wolfe Established in 1998, the Law Offices of Forrest F. Wolfe offers Free Initial Consultations in the areas of Estate Planning and Probate.…","Law Offices of Forrest F. Wolfe","(909) 757-1580",,,"https://www.yellowpages.com/ontario-ca/mip/law-offices-of-forrest-f-wolfe-462018862?lid=1002157756080","http://www.trustwolfe.com"
"575 E Alluvial Ave Ste 105, Fresno, CA 93720",,"Carol Ann Moses","(559) 449-9069",,,"https://www.yellowpages.com/fresno-ca/mip/carol-ann-moses-465463773?lid=1000088486777",
"Modesto, CA 95354",,"Isaac Terri L Attorney At Law","(209) 214-7803","5","She is absolutely an amazing family lawyer could not ask for anyone better, sorry to see her leave the family law side since she helped us so much and was so supportive, but I…","https://www.yellowpages.com/modesto-ca/mip/isaac-terri-l-attorney-at-law-465962491?lid=1002166398864",
